{
  "schemaVersion": "1.0",
  "document": {
    "documentKey": "java-advanced-interview",
    "title": "Java 高级开发面试题完整答案",
    "description": "结构化导入示例",
    "language": "zh-CN",
    "tags": [
      "Java",
      "面试",
      "并发"
    ]
  },
  "version": {
    "versionKey": "v1",
    "sourceType": "PDF",
    "sourceFileName": "Java高级开发面试题完整答案.pdf",
    "converterVersion": "pdfbox-outline-0.1.0",
    "metadata": {
      "pageCount": 77
    }
  },
  "sections": [
    {
      "sectionKey": "q1",
      "parentSectionKey": null,
      "level": 1,
      "nodeType": "QUESTION",
      "semanticRole": "QUESTION",
      "title": "1. HashMap 为什么线程不安全？",
      "sortOrder": 10,
      "anchor": "hashmap-thread-safety",
      "sourcePageStart": 4,
      "sourcePageEnd": 6
    },
    {
      "sectionKey": "q1-conclusion",
      "parentSectionKey": "q1",
      "level": 2,
      "nodeType": "SECTION",
      "semanticRole": "CONCLUSION",
      "title": "1.1 结论先行",
      "sortOrder": 10,
      "anchor": "hashmap-thread-safety-conclusion",
      "sourcePageStart": 4,
      "sourcePageEnd": 4
    }
  ],
  "blocks": [
    {
      "blockKey": "q1-conclusion-p1",
      "sectionKey": "q1-conclusion",
      "seq": 1,
      "blockType": "paragraph",
      "payload": {
        "text": "HashMap 的设计目标是单线程下提供高效查询与更新，它没有为复合操作、结构修改和内存可见性提供并发保证。"
      },
      "plainText": "HashMap 的设计目标是单线程下提供高效查询与更新，它没有为复合操作、结构修改和内存可见性提供并发保证。",
      "sourcePage": 4,
      "confidence": 0.99
    }
  ],
  "assets": []
}